{
  "meta": {
    "slug": "test-intake-2099",
    "schema_version": 1,
    "ids": {},
    "title": "Intake Test",
    "title_cn": "队列测试",
    "year": 2099,
    "total_eps": 3,
    "unit": "章",
    "primary_kpi": "imdb",
    "updated": "2026-10-20"
  },
  "about": {},
  "intro": {},
  "episodes": [
    {
      "n": 1,
      "sources": {},
      "synopsis": {}
    },
    {
      "n": 2,
      "sources": {},
      "synopsis": {}
    },
    {
      "n": 3,
      "sources": {},
      "synopsis": {}
    }
  ],
  "route": []
}
